{
  "catalog_version": "0.1.0",
  "diagnostic_tests": [
    {
      "algorithm_summary": "Re-extract the cell barcode at a range of start offsets around the expected position and measure the whitelist-match rate at each offset.",
      "interpretation": "A sharp match-rate peak at a non-zero offset supports a barcode boundary shift; a strong diagnosis also shows restored whitelist rate and ideally improved molecule/cell recovery after re-extraction.",
      "limitations": "Cannot distinguish a boundary shift from a wrong whitelist if no offset restores the match rate.",
      "outputs": "Whitelist-match rate as a function of offset; the offset that maximises the match rate.",
      "purpose": "Detect a barcode/UMI extraction boundary shift by scanning candidate offsets.",
      "rejects_causes": [
        "cause.wrong_chemistry_or_whitelist"
      ],
      "required_inputs": [
        "read_processing"
      ],
      "status": "planned",
      "supports_causes": [
        "cause.barcode_boundary_shift"
      ],
      "test_id": "test.barcode_offset_scan",
      "title": "Barcode offset scan"
    },
    {
      "algorithm_summary": "Match extracted barcodes against several candidate chemistry whitelists and compare match rates.",
      "interpretation": "A markedly higher match rate against a different whitelist supports a wrong-chemistry/whitelist cause.",
      "limitations": "Requires the true chemistry's whitelist to be among the candidates.",
      "outputs": "Per-whitelist match rate; the best-matching chemistry.",
      "purpose": "Identify whether a different chemistry whitelist explains the barcodes.",
      "required_inputs": [
        "read_processing"
      ],
      "status": "planned",
      "supports_causes": [
        "cause.wrong_chemistry_or_whitelist",
        "cause.barcode_boundary_shift"
      ],
      "test_id": "test.alternative_whitelist_scan",
      "title": "Alternative-whitelist scan"
    },
    {
      "algorithm_summary": "Compare observed read lengths and segment positions against the spec's read_structure (R1 length vs cell barcode + UMI, expected cycles, orientation).",
      "interpretation": "Any mismatch (e.g. R1 shorter than barcode + UMI) supports a read-configuration cause.",
      "limitations": "Detects layout mismatches, not whether an otherwise-valid configuration was mis-processed.",
      "outputs": "A list of mismatches between observed and expected read configuration.",
      "purpose": "Check that the observed read layout matches the chemistry's expected barcode/UMI/insert geometry.",
      "required_inputs": [
        "read_processing"
      ],
      "status": "planned",
      "supports_causes": [
        "cause.read_configuration_mismatch",
        "cause.wrong_chemistry_or_whitelist"
      ],
      "test_id": "test.read_configuration_audit",
      "title": "Read-configuration audit"
    },
    {
      "algorithm_summary": "Attempt barcode/UMI extraction with R1 and R2 roles swapped and compare whitelist-match rates.",
      "interpretation": "A much higher match rate in the swapped orientation supports an R1/R2 swap.",
      "limitations": "Only distinguishes a swap, not other configuration errors.",
      "outputs": "Whitelist-match rate in normal vs swapped orientation.",
      "purpose": "Detect whether read 1 and read 2 were swapped.",
      "required_inputs": [
        "read_processing"
      ],
      "status": "planned",
      "supports_causes": [
        "cause.read_configuration_mismatch"
      ],
      "test_id": "test.r1_r2_swap_test",
      "title": "R1/R2 swap test"
    },
    {
      "algorithm_summary": "Scan each read for the expected adapters/handles and classify by which are present and where; the Nanopore path implements this per-read classification.",
      "implemented_by": "qc/nanopore.py: read_classification / handle_detection",
      "interpretation": "Elevated adapter-only / short-insert fractions support adapter-dimer / short-cDNA causes.",
      "limitations": "Read-level configuration fractions are not the same as physical library fractions.",
      "outputs": "Per-configuration read fractions (full-length, adapter-only, short-insert, unclassified).",
      "purpose": "Classify each read by its adapter/handle configuration to quantify full-length, adapter-only, short-insert, and TSO-proximal reads.",
      "references": [
        "ref.wf_single_cell_docs"
      ],
      "required_inputs": [
        "library_structure"
      ],
      "status": "implemented",
      "supports_causes": [
        "cause.adapter_dimer_or_short_insert",
        "cause.short_or_empty_cdna_products",
        "cause.read_past_end_or_signal_decay"
      ],
      "test_id": "test.adapter_configuration_classification",
      "title": "Adapter-configuration classification"
    },
    {
      "algorithm_summary": "Scan long reads for TSO-derived motifs occurring internally (away from read ends); the Nanopore path implements this as the tso_concatemer check.",
      "implemented_by": "qc/nanopore.py: tso_concatemer",
      "interpretation": "An elevated internal-TSO fraction supports a long-read concatemer/fusion cause; it is distinct from short-read TSO read-through.",
      "limitations": "Cannot by itself establish cross-sample molecule mixing.",
      "outputs": "Internal-adapter fraction and per-read internal-motif positions.",
      "purpose": "Detect internal TSO-derived motifs in long reads indicating concatemers or fused molecules.",
      "references": [
        "ref.lebrigand_2020"
      ],
      "required_inputs": [
        "library_structure"
      ],
      "status": "implemented",
      "supports_causes": [
        "cause.long_read_tso_concatemer_or_fusion"
      ],
      "test_id": "test.internal_tso_scan",
      "title": "Internal TSO scan (long-read)"
    },
    {
      "algorithm_summary": "Recompute called cells across a range of calling thresholds and inspect where the count stabilises relative to the knee.",
      "interpretation": "A large increase in called cells when the threshold is relaxed supports overly strict calling; a flat curve points upstream (input/capture).",
      "limitations": "Cannot create cells that were never captured; distinguishes calling strictness from upstream loss only when molecules exist near the knee.",
      "outputs": "Called-cell count as a function of threshold.",
      "purpose": "Assess how called-cell count varies with the cell-calling threshold.",
      "required_inputs": [
        "cell_analysis"
      ],
      "status": "planned",
      "supports_causes": [
        "cause.overly_strict_cell_calling",
        "cause.insufficient_viable_cell_input",
        "cause.poor_partition_capture_or_rt"
      ],
      "test_id": "test.cell_calling_sensitivity",
      "title": "Cell-calling sensitivity analysis"
    },
    {
      "algorithm_summary": "Re-extract barcodes/UMIs at the offset found by the offset scan and recompute whitelist rate and downstream molecule/cell recovery.",
      "interpretation": "Restored whitelist rate and improved recovery confirm a barcode boundary shift and demonstrate computational recoverability.",
      "limitations": "Full recovery requires that the shift is the dominant defect.",
      "outputs": "Whitelist rate and recovery before vs after counterfactual re-extraction.",
      "purpose": "Confirm a barcode boundary shift by re-extracting at the corrected offset and measuring recovery.",
      "required_inputs": [
        "read_processing",
        "cell_analysis"
      ],
      "status": "planned",
      "supports_causes": [
        "cause.barcode_boundary_shift",
        "cause.read_configuration_mismatch"
      ],
      "test_id": "test.counterfactual_barcode_reextraction",
      "title": "Counterfactual barcode re-extraction"
    }
  ],
  "issues": [
    {
      "candidate_root_causes": [
        "cause.barcode_boundary_shift",
        "cause.read_configuration_mismatch",
        "cause.wrong_chemistry_or_whitelist",
        "cause.overly_strict_cell_calling",
        "cause.insufficient_viable_cell_input",
        "cause.poor_partition_capture_or_rt",
        "cause.low_cdna_or_library_yield"
      ],
      "computational_actions": [
        "Barcode offset / alternative-whitelist scan and re-extraction",
        "Cell-calling sensitivity sweep"
      ],
      "confirmatory_tests": [
        "test.barcode_offset_scan",
        "test.alternative_whitelist_scan",
        "test.read_configuration_audit",
        "test.cell_calling_sensitivity",
        "test.counterfactual_barcode_reextraction"
      ],
      "impacts": [
        "Fewer called cells and reduced statistical power",
        "Potentially biased population representation if loss is non-random"
      ],
      "issue_id": "issue.low_cell_recovery",
      "missing_evidence": [
        "Viable-cell input / cells-loaded from wet-lab metadata (needed to separate input loss from processing loss)",
        "Raw FASTQ for counterfactual barcode re-extraction"
      ],
      "outcome_domains": [
        "cell_analysis"
      ],
      "platforms": [
        "illumina",
        "nanopore"
      ],
      "recovery_classes": [
        "computationally_recoverable",
        "partially_recoverable",
        "requires_experiment_rerun"
      ],
      "references": [
        "ref.tenx_3p_v3_userguide",
        "ref.cellranger_web_summary"
      ],
      "related_issues": [
        "issue.barcode_umi_recovery_failure",
        "issue.low_informative_read_yield"
      ],
      "required_evidence": [
        "cell_analysis",
        "read_processing"
      ],
      "sequencing_actions": [
        "Additional sequencing only helps if the library is sound but shallow"
      ],
      "summary": "Far fewer cells were called than the declared target. Many mechanisms can cause this, from barcode-processing errors to insufficient input; the target must be a compatible target type before comparing.",
      "supporting_signals": [